{"candidate": "baseline", "change": "Frozen incumbent replay; boot excluded from JIT precision as in original study", "split": "train", "metrics": {"cases": 168, "jit_tp": 141, "jit_fp": 427, "precision": 0.2482394366197183, "availability_hits": 1354, "applications": 1690, "availability": 0.8011834319526627, "text_tokens": 230085.25, "unjudged": 60}, "train_precision": 0.2482394366197183, "train_availability": 0.8011834319526627, "train_tokens": 230085.25, "verdict": "baseline", "reason": "Baseline", "jev_calls": 0, "jev_calls_total": 0, "source_sha256": "3d2a4d520a9b0fa01e3cfc042620a79f6ee04c8408a095d3fee2056770631b35"}
{"candidate": "predicate-v1", "change": "Conjunctive per-rule actions and negative predicates; adds known actions", "split": "train", "metrics": {"cases": 168, "jit_tp": 142, "jit_fp": 347, "precision": 0.2903885480572597, "availability_hits": 1355, "applications": 1690, "availability": 0.8017751479289941, "text_tokens": 163038.0, "unjudged": 0}, "train_precision": 0.2903885480572597, "train_availability": 0.8017751479289941, "train_tokens": 163038.0, "verdict": "reverted", "reason": "Availability below81.3%; broad action additions still noisy", "jev_calls": 0, "jev_calls_total": 0, "source_sha256": "3d2a4d520a9b0fa01e3cfc042620a79f6ee04c8408a095d3fee2056770631b35"}
{"accepted_gain_pp": 0, "candidate": "today", "change": "Unchanged current replay. No candidate.", "errors": 0, "events_count": 461, "evidence": "baseline-train.json", "evidence_sha256": "9741a0ad860f23fe981f2c3a7f41575096e90156404c4eb95556b348b81f3a74", "jev_calls": 0, "jev_calls_total": 0, "precision_gain_pp": null, "reason": "Frozen training baseline.", "round": 0, "schema": "ruleprecision-climb/v1", "test_touched": false, "timestamp": "2026-10-05T22:15:36.716281+00:00", "tokens_unit": "statement characters/4, union per synthetic case (session proxy)", "train": {"applications": 1690, "availability": 0.8011834319526627, "availability_hits": 1354, "cases": 168, "jit_fp": 427, "jit_tp": 141, "precision": 0.2482394366197183, "text_tokens": 230085.25, "unjudged": 60}, "train_availability": 0.8011834319526627, "train_precision": 0.2482394366197183, "train_tokens": 230085.25, "verdict": "baseline", "campaign": "train-calibration"}
{"accepted_gain_pp": 0, "candidate": "predicate-v1", "change": "Conjunctive subject/action refinements with tool-action additions.", "errors": 0, "events_count": 461, "evidence": "round00.json", "evidence_sha256": "b59c156b3de9c3cb08b837ebf2f86a656e40d3a16ff61d224dfa21b648676c20", "jev_calls": 0, "jev_calls_total": 0, "precision_gain_pp": 4.587821043910523, "reason": "Availability below583/717 floor.", "round": 1, "schema": "ruleprecision-climb/v1", "test_touched": false, "timestamp": "2026-10-05T22:15:36.717166+00:00", "tokens_unit": "statement characters/4, union per synthetic case (session proxy)", "train": {"applications": 1690, "availability": 0.8005917159763314, "availability_hits": 1353, "cases": 168, "jit_fp": 336, "jit_tp": 140, "precision": 0.29411764705882354, "text_tokens": 156697.25, "unjudged": 0}, "train_availability": 0.8005917159763314, "train_precision": 0.29411764705882354, "train_tokens": 156697.25, "verdict": "reverted", "campaign": "train-calibration"}
{"accepted_gain_pp": 11.40600286209234, "candidate": "action-coverage-v2", "change": "Recognize independent review, partner correction, code intent, explicit record mutations.", "errors": 0, "events_count": 461, "evidence": "round01.json", "evidence_sha256": "67bde7f7c79e447fe77a5cb2758cad2f9cb6b167f177d491ec355a74d162da24", "jev_calls": 0, "jev_calls_total": 0, "precision_gain_pp": 11.40600286209234, "reason": "Precision and availability improved; availability87.81% gives filtering headroom.", "round": 2, "schema": "ruleprecision-climb/v1", "test_touched": false, "timestamp": "2026-10-05T22:15:36.717867+00:00", "tokens_unit": "statement characters/4, union per synthetic case (session proxy)", "train": {"applications": 1690, "availability": 0.8781065088757396, "availability_hits": 1484, "cases": 168, "jit_fp": 477, "jit_tp": 271, "precision": 0.3622994652406417, "text_tokens": 248073.5, "unjudged": 0}, "train_availability": 0.8781065088757396, "train_precision": 0.3622994652406417, "train_tokens": 248073.5, "verdict": "kept", "campaign": "train-calibration"}
{"accepted_gain_pp": 0, "candidate": "empirical-cutoff-0.60", "change": "Calibrate each rule from round1 TRAIN TP/(TP+FP); omit rules below0.60.", "errors": 0, "events_count": 461, "evidence": "round02.json", "evidence_sha256": "918f37eff665241f7097d8e312c2757c9ff01d0aaeea4eab300c22b112581f7a", "jev_calls": 0, "jev_calls_total": 0, "precision_gain_pp": 46.270053475935825, "reason": "Precision82.5% but availability79.59% fails required floor.", "round": 3, "schema": "ruleprecision-climb/v1", "test_touched": false, "timestamp": "2026-10-05T22:15:36.718409+00:00", "tokens_unit": "statement characters/4, union per synthetic case (session proxy)", "train": {"applications": 1690, "availability": 0.7958579881656804, "availability_hits": 1345, "cases": 168, "jit_fp": 28, "jit_tp": 132, "precision": 0.825, "text_tokens": 60103.5, "unjudged": 0}, "train_availability": 0.7958579881656804, "train_precision": 0.825, "train_tokens": 60103.5, "verdict": "reverted", "campaign": "train-calibration"}
{"accepted_gain_pp": 42.71742189698846, "candidate": "material-findings-v3-cutoff-0.50", "change": "Threshold0.50 plus exclude background/monitor completion from agent findings; narrow independent-review cues.", "errors": 0, "events_count": 461, "evidence": "round03.json", "evidence_sha256": "9d348456057796be8b9fb21fb3e9462b4afc3280dbfc5fed2d88b125c2c02274", "jev_calls": 0, "jev_calls_total": 0, "precision_gain_pp": 42.71742189698846, "reason": "Precision78.95%, availability82.43%; both improve over retainedround1.", "round": 4, "schema": "ruleprecision-climb/v1", "test_touched": false, "timestamp": "2026-10-05T22:15:36.718939+00:00", "tokens_unit": "statement characters/4, union per synthetic case (session proxy)", "train": {"applications": 1690, "availability": 0.8242603550295858, "availability_hits": 1393, "cases": 168, "jit_fp": 48, "jit_tp": 180, "precision": 0.7894736842105263, "text_tokens": 85621.0, "unjudged": 0}, "train_availability": 0.8242603550295858, "train_precision": 0.7894736842105263, "train_tokens": 85621.0, "verdict": "kept", "campaign": "train-calibration"}
{"accepted_gain_pp": 0, "candidate": "evidence-and-lookup-v4", "change": "Require material notification result evidence; refine taught-rule boundary; add broad current-state/source lookup.", "errors": 0, "events_count": 461, "evidence": "round04.json", "evidence_sha256": "3f5851e8a7df4243d346b6550ede45c3654893aeaafc37d6fe09a1c3fd1da937", "jev_calls": 0, "jev_calls_total": 0, "precision_gain_pp": -7.687525901367598, "real_train": {"applications": 616, "availability": 1.0, "availability_hits": 616, "cases": 121, "jit_fp": 0, "jit_tp": 101, "precision": 1.0, "text_tokens": 7145.75, "unjudged": 0}, "reason": "Synthetic precision71.26% regresses, although realTRAIN100%; incompatible labelscope remains visible.", "round": 5, "schema": "ruleprecision-climb/v1", "test_touched": false, "timestamp": "2026-10-05T22:15:36.719457+00:00", "tokens_unit": "statement characters/4, union per synthetic case (session proxy)", "train": {"applications": 1690, "availability": 0.8248520710059172, "availability_hits": 1394, "cases": 168, "jit_fp": 73, "jit_tp": 181, "precision": 0.7125984251968503, "text_tokens": 84101.5, "unjudged": 0}, "train_availability": 0.8248520710059172, "train_precision": 0.7125984251968503, "train_tokens": 84101.5, "verdict": "reverted", "campaign": "train-calibration"}
{"accepted_gain_pp": 2.4162679425837275, "candidate": "source-lookup-v5", "change": "Keep source/governance lookup, omit state/git read additions, retain material result evidence and taught-rule refinement.", "errors": 0, "events_count": 461, "evidence": "round05.json", "evidence_sha256": "545f8d36773dc99cd04cf24470747a1820f8bc56ad1b0c363388767cf3242e25", "jev_calls": 0, "jev_calls_total": 0, "precision_gain_pp": 2.4162679425837275, "real_train": {"applications": 616, "availability": 0.9561688311688312, "availability_hits": 589, "cases": 121, "jit_fp": 0, "jit_tp": 74, "precision": 1.0, "text_tokens": 5235.5, "unjudged": 0}, "reason": "Precision81.36%, availability82.37%; availability margin1.056 percentagepoints.", "round": 6, "schema": "ruleprecision-climb/v1", "test_touched": false, "timestamp": "2026-10-05T22:15:36.720245+00:00", "tokens_unit": "statement characters/4, union per synthetic case (session proxy)", "train": {"applications": 1690, "availability": 0.8236686390532545, "availability_hits": 1392, "cases": 168, "jit_fp": 41, "jit_tp": 179, "precision": 0.8136363636363636, "text_tokens": 81696.0, "unjudged": 0}, "train_availability": 0.8236686390532545, "train_precision": 0.8136363636363636, "train_tokens": 81696.0, "verdict": "kept", "campaign": "train-calibration"}
{"accepted_gain_pp": 0, "candidate": "point-optimal-rule-knapsack", "change": "Finite exhaustive per-rule accept/reject combinations from round5 TRAIN counts, retaining retrieval and583/717 availability floor.", "errors": 0, "events_count": 461, "evidence": "round06.json", "evidence_sha256": "8b9b5a920b98deea31465b58c74b0ec453d40c5a5e9568f58033d74bead7c11f", "jev_calls": 0, "jev_calls_total": 0, "precision_gain_pp": 2.1415182755389006, "reason": "Precision83.51% at81.361% availability; only0.05 percentagepoint margin. Reject on TRAIN-only robustness against sparse rule calibration.", "round": 7, "schema": "ruleprecision-climb/v1", "test_touched": false, "timestamp": "2026-10-05T22:15:36.721114+00:00", "tokens_unit": "statement characters/4, union per synthetic case (session proxy)", "train": {"applications": 1690, "availability": 0.8136094674556213, "availability_hits": 1375, "cases": 168, "jit_fp": 32, "jit_tp": 162, "precision": 0.8350515463917526, "text_tokens": 78678.75, "unjudged": 0}, "train_availability": 0.8136094674556213, "train_precision": 0.8350515463917526, "train_tokens": 78678.75, "verdict": "reverted", "campaign": "train-calibration"}
{"accepted_gain_pp": 0, "candidate": "minimum-positive-support-3", "change": "Drop per-rule delivery with fewer than3 observed TRAIN true positives; keep remaining round5 predicates.", "errors": 0, "events_count": 461, "evidence": "round07.json", "evidence_sha256": "54e2f1da400dd145c2afa7b2bbfdd29633007e3a46eb05d11734792e74e9adc0", "jev_calls": 0, "jev_calls_total": 0, "precision_gain_pp": -0.14297908664105963, "reason": "Precision81.22% drops and availability82.01% loses coverage; no accepted gain.", "round": 8, "schema": "ruleprecision-climb/v1", "test_touched": false, "timestamp": "2026-10-05T22:15:36.721626+00:00", "tokens_unit": "statement characters/4, union per synthetic case (session proxy)", "train": {"applications": 1690, "availability": 0.8201183431952662, "availability_hits": 1386, "cases": 168, "jit_fp": 40, "jit_tp": 173, "precision": 0.812206572769953, "text_tokens": 78464.5, "unjudged": 0}, "train_availability": 0.8201183431952662, "train_precision": 0.812206572769953, "train_tokens": 78464.5, "verdict": "reverted", "campaign": "train-calibration"}
{"accepted_gain_pp": 0, "candidate": "baseline-conjunction-only", "change": "Disable all action additions; keep calibrated baseline refinements and rule gates.", "errors": 0, "events_count": 461, "evidence": "round08.json", "evidence_sha256": "b1c453beb55ea614a844b9f0dfe9e0092eab534a42d64f679b55def18df083e4", "jev_calls": 0, "jev_calls_total": 0, "precision_gain_pp": 4.106449106449106, "reason": "Precision85.47% but availability77.69% fails floor; no admissible gain.", "round": 9, "schema": "ruleprecision-climb/v1", "test_touched": false, "timestamp": "2026-10-05T22:15:36.722180+00:00", "tokens_unit": "statement characters/4, union per synthetic case (session proxy)", "train": {"applications": 1690, "availability": 0.7769230769230769, "availability_hits": 1313, "cases": 168, "jit_fp": 17, "jit_tp": 100, "precision": 0.8547008547008547, "text_tokens": 41900.0, "unjudged": 0}, "train_availability": 0.7769230769230769, "train_precision": 0.8547008547008547, "train_tokens": 41900.0, "verdict": "reverted", "campaign": "train-calibration"}
